{
  "decision": "pass",
  "challenged_findings": ["DEV-011-001"],
  "supporting_evidence": [
    "D902年度预算为50000元，R900018（45000元）后累计45000元，未触发阈值",
    "R900019（6000元）后累计51000元，首次超过1.0倍预算（50000元）",
    "R900019的special_approval=0，确认无专项审批",
    "R900020累计56000元但special_approval=1，已正确排除"
  ],
  "opposing_evidence": [],
  "exceptions_or_boundaries": [
    {
      "type": "threshold_boundary",
      "detail": "预算阈值50000元（1.0倍），R900018累计45000元未触及，R900019累计51000元首次超过",
      "verified": true
    },
    {
      "type": "special_approval_exemption",
      "detail": "R900020有专项审批（special_approval=1），正确排除；R900019无专项审批",
      "verified": true
    }
  ],
  "required_changes": [],
  "supplemental_query": null,
  "rationale": "三条记录的累计计算清晰无歧义：45000<50000，45000+6000=51000>50000，R900019是且仅是首个导致超预算的记录。R900019无专项审批（special_approval=0），R900020有专项审批（special_approval=1）被正确排除。无日期边界、重复、冲销或空值问题。",
  "unresolved_conflicts": []
}
