{
  "decision": "pass",
  "challenged_findings": [
    {
      "anomaly_id": "ANOM-RR-CASE-001",
      "challenge": "四笔记录具有不同供应商、不同培训主题（合规实务学习、投行业务培训、专业技能培训、项目管理培训），可能为独立培训事件而非同一事项拆分",
      "resolution": "驳回。制度第十一条的触发条件为机械性规则：同一员工、同一费用类型、7天内2笔及以上、合计达到较高审批线。即使业务理由独立，拆分结果客观导致每笔回避了AR-02的财务复核要求，构成拆分规避审批风险。制度使用'应重点核查'措辞，审计层面应标记为异常以供进一步核查"
    },
    {
      "anomaly_id": "ANOM-RR-CASE-001",
      "challenge": "7天窗口包含12月18日至25日，跨度恰好7天（含首尾），R001354与R000465相差恰好7天，处于边界",
      "resolution": "确认。12-18至12-25为7天（含首尾），制度第十一条未明确是否含首尾天数，但按金融行业惯例及从严解释，7天内包含首日。另R000561仅差2天、R000888仅差5天，均已明确落入窗口"
    }
  ],
  "supporting_evidence": [
    "四笔记录均为同一员工E0041、同一费用类型training_fee",
    "四笔记录均在7天窗口内（2025-12-18至2025-12-25）",
    "各笔金额分别为2,157.72、2,917.45、2,606.07、2,083.49，均低于AR-01门槛3,000元",
    "合计9,764.73元达到AR-02区间（3,000-10,000）",
    "四笔均仅有AR-01审批（部门经理E0005），无财务复核"
  ],
  "opposing_evidence": [
    "四笔记录使用四个不同供应商的四张不同发票",
    "培训主题各不相同（合规实务学习、投行业务培训、专业技能培训、项目管理培训）",
    "每张发票仅使用1次，无重复报销"
  ],
  "exceptions_or_boundaries": [
    {"type": "date_boundary", "detail": "R001354与R000465相差恰好7天，处于边界", "resolution": "确认在窗口内"},
    {"type": "amount_boundary", "detail": "R000561(2917.45)接近AR-01上限3000", "resolution": "仍在AR-01区间，未越界"},
    {"type": "amount_boundary", "detail": "合计9764.73接近AR-03下限10000", "resolution": "在AR-02区间，未触发AR-03"}
  ],
  "required_changes": [],
  "supplemental_query": null,
  "rationale": "虽然四笔记录可能对应独立培训事件，但制度第十一条的拆分规避审批核查为机械性条件检查。同一员工在7天窗口内密集提交4笔同类费用且每笔均回避更高审批层级的现象，客观上构成第十一条所述核查情形。审计层面应标记为异常，建议业务部门逐笔核实培训真实性后方可确认合规。",
  "unresolved_conflicts": []
}
